{"metadata":{"documentType":"LEVEL_MODIFIER","schemaVersion":1,"key":"INTERMEDIATE_MODIFIER","version":1,"status":"PUBLISHED","contentHash":"c5e9d601f2756495c921676cb323872539eb65f901135b1240e27034861bff34"},"experience":"INTERMEDIATE","eligibleWorkoutKeys":["EASY_STANDARD","FARTLEK","GOAL_PACE_TEN_K","LONG_RUN_STANDARD","THRESHOLD_TEMPO"],"progressionModifier":{"documentType":"PROGRESSION_MODIFIER","key":"INTERMEDIATE_PROGRESSION_MODIFIER_V1","version":1}}