{
  "metadata": {
    "documentType": "LEVEL_MODIFIER",
    "schemaVersion": 2,
    "key": "INTERMEDIATE_MODIFIER",
    "version": 3,
    "status": "DRAFT"
  },
  "experience": "INTERMEDIATE",
  "eligibleWorkouts": [
    { "documentType": "WORKOUT_DEFINITION", "key": "EASY_STANDARD", "version": 3 },
    { "documentType": "WORKOUT_DEFINITION", "key": "LONG_RUN_STANDARD", "version": 3 },
    { "documentType": "WORKOUT_DEFINITION", "key": "FARTLEK", "version": 3 },
    { "documentType": "WORKOUT_DEFINITION", "key": "THRESHOLD_TEMPO", "version": 3 },
    { "documentType": "WORKOUT_DEFINITION", "key": "GOAL_PACE_TEN_K", "version": 1 }
  ],
  "progressionModifier": {
    "documentType": "PROGRESSION_MODIFIER",
    "key": "INTERMEDIATE_PROGRESSION_MODIFIER_V1",
    "version": 1
  }
}
