{
  "metadata": {
    "documentType": "LEVEL_MODIFIER",
    "schemaVersion": 2,
    "key": "INTERMEDIATE_MODIFIER",
    "version": 8,
    "status": "VALIDATED"
  },
  "experience": "INTERMEDIATE",
  "eligibleWorkouts": [
    { "documentType": "WORKOUT_DEFINITION", "key": "EASY_STANDARD", "version": 4 },
    { "documentType": "WORKOUT_DEFINITION", "key": "LONG_RUN_STANDARD", "version": 4 },
    { "documentType": "WORKOUT_DEFINITION", "key": "FARTLEK", "version": 4 },
    { "documentType": "WORKOUT_DEFINITION", "key": "THRESHOLD_TEMPO", "version": 4 },
    { "documentType": "WORKOUT_DEFINITION", "key": "HM_PACE", "version": 1 }
  ],
  "progressionModifier": {
    "documentType": "PROGRESSION_MODIFIER",
    "key": "INTERMEDIATE_PROGRESSION_MODIFIER_V1",
    "version": 4
  }
}
