{"metadata":{"documentType":"LEVEL_MODIFIER","schemaVersion":2,"key":"ADVANCED_MODIFIER","version":1,"status":"PUBLISHED","contentHash":"9befb70a8b010aa7976039f2fc9dc7bade52d9231fd5752a466ccfe0fcd4c121"},"experience":"ADVANCED","eligibleWorkouts":[{"documentType":"WORKOUT_DEFINITION","key":"EASY_STANDARD","version":4},{"documentType":"WORKOUT_DEFINITION","key":"LONG_RUN_STANDARD","version":4},{"documentType":"WORKOUT_DEFINITION","key":"FARTLEK","version":4},{"documentType":"WORKOUT_DEFINITION","key":"THRESHOLD_TEMPO","version":4},{"documentType":"WORKOUT_DEFINITION","key":"GOAL_PACE_TEN_K","version":2}],"progressionModifier":{"documentType":"PROGRESSION_MODIFIER","key":"ADVANCED_PROGRESSION_MODIFIER_V1","version":1}}