{
  "metadata": {
    "documentType": "LEVEL_MODIFIER",
    "schemaVersion": 2,
    "key": "BEGINNER_MODIFIER",
    "version": 2,
    "status": "VALIDATED"
  },
  "experience": "NEW",
  "eligibleWorkouts": [
    { "documentType": "WORKOUT_DEFINITION", "key": "EASY_STANDARD", "version": 4 },
    { "documentType": "WORKOUT_DEFINITION", "key": "LONG_RUN_STANDARD", "version": 4 },
    { "documentType": "WORKOUT_DEFINITION", "key": "FARTLEK", "version": 4 },
    { "documentType": "WORKOUT_DEFINITION", "key": "THRESHOLD_TEMPO", "version": 4 },
    { "documentType": "WORKOUT_DEFINITION", "key": "HM_PACE", "version": 1 }
  ],
  "progressionModifier": {
    "documentType": "PROGRESSION_MODIFIER",
    "key": "BEGINNER_PROGRESSION_MODIFIER_V1",
    "version": 1
  }
}
